{
  "documentId": "DOC-00028",
  "family": "authority",
  "headline": "Handwerkskammer Ostwestfalen-Lippe zu Bielefeld · Beitragsbescheid 2026",
  "factOrder": [
    "authority",
    "subject",
    "reference",
    "deadline",
    "demand"
  ],
  "facts": [
    {
      "id": "authority",
      "value": "Handwerkskammer Ostwestfalen-Lippe zu Bielefeld"
    },
    {
      "id": "subject",
      "value": "Handwerkskammer Ostwestfalen-Lippe zu Bielefeld · Beitragsbescheid 2026"
    }
  ]
}
