{
  "documentId": "DOC-00026",
  "family": "generic",
  "headline": "Cirmak Haustechnik · Urlaubsantrag – Lukas Hoffmann",
  "factOrder": [
    "sender",
    "subject",
    "amount",
    "deadline",
    "site"
  ],
  "facts": [
    {
      "id": "subject",
      "value": "Cirmak Haustechnik · Urlaubsantrag – Lukas Hoffmann"
    }
  ]
}
